{
  "title": "天机 · 陈明远 个人命理测算（示例）",
  "scenario": "个人深度测算示例：虚构人物，用于演示固定报告格式。",
  "confidence": [
    [
      "四柱八字",
      "★★★★☆",
      "真太阳时 13:58 位于未时中段，时柱稳定"
    ],
    [
      "紫微斗数",
      "★★★★☆",
      "依赖时辰，时辰稳定"
    ],
    [
      "西洋星座",
      "★★★★☆",
      "太阳、月亮远离星座边界"
    ],
    [
      "三才五格",
      "★★★☆☆",
      "依赖康熙笔画口径"
    ]
  ],
  "persons": [
    {
      "name": "陈明远",
      "strength": "身弱（庚金生卯月，木旺泄耗）",
      "favor": "喜土金扶身，忌火木水再耗",
      "wx_reading": [
        {
          "adv": "金水相生，思路清晰、表达精炼。",
          "risk": "原局缺火，行动热度与对外展示偏弱。",
          "act": "用固定的公开输出节奏补足“火”的外显。"
        }
      ],
      "shishen_reading": {
        "adv": "食伤两现，擅长拆解问题、产出方案。",
        "risk": "伤官透出，容易对规则与权威直接表达不满。",
        "act": "先给结论与证据，再提批评。"
      },
      "bone_reading": {
        "adv": "3两9钱，歌诀强调“苦心竭力成家计”，重自力。",
        "risk": "前期付出与回报不成比例时容易怀疑方向。",
        "act": "以三年为单位复盘积累，不以单年得失定论。"
      },
      "ming_reading": "命宫申宫天同、天梁同守且天梁化禄，倾向稳健、照顾人、重规则；身宫落福德宫太阳，理念感强。",
      "dayun_note": "35–44岁走田宅宫大限（亥宫无主星，借廉贞·贪狼），重心在家庭与资产安顿；45岁起进入官禄宫天机大限，宜从执行转向体系建设。",
      "palace_readings": [
        {
          "palace": "命宫",
          "question": "我靠什么立身？",
          "triad": {
            "adv": "同梁化禄，人缘与口碑是天然资产。",
            "risk": "过度照顾他人而稀释自身目标。",
            "act": "每年设定一项只为自己的硬目标。"
          }
        },
        {
          "palace": "官禄宫",
          "question": "我适合怎样的工作？",
          "triad": {
            "adv": "天机主谋略，适合研究、规划、咨询。",
            "risk": "擎羊同宫，压力大时易与同事硬碰。",
            "act": "把冲突转化为书面方案讨论。"
          }
        },
        {
          "palace": "财帛宫",
          "question": "钱从哪里来？",
          "triad": {
            "adv": "太阴主积累，适合稳定现金流与长期资产。",
            "risk": "不擅短线博弈。",
            "act": "采用定投与固定储蓄比例。"
          }
        },
        {
          "palace": "夫妻宫",
          "question": "亲密关系的课题是什么？",
          "triad": {
            "adv": "巨门重沟通，关系靠深谈维系。",
            "risk": "言语直接易伤人。",
            "act": "约定冷静期再讨论分歧。"
          }
        },
        {
          "palace": "福德宫",
          "question": "精神能量从哪里补？",
          "triad": {
            "adv": "身宫落福德、太阳同宫，愿意为理念付出。",
            "risk": "陀罗拖慢决断，易反复内耗。",
            "act": "设定决策截止时间。"
          }
        },
        {
          "palace": "疾厄宫",
          "question": "身体要注意什么？",
          "triad": {
            "adv": "天府守疾厄，底子稳。",
            "risk": "久坐与饮食不规律累积成问题。",
            "act": "每周三次力量或有氧训练。"
          }
        }
      ],
      "western_combo": {
        "adv": "双鱼太阳、狮子月亮与上升：内在敏感，外在有存在感。",
        "risk": "情绪需求被忽视时会以骄傲掩饰。",
        "act": "主动表达被认可的需要。"
      },
      "wuge_reading": {
        "adv": "人格24、总格41，数理偏吉，综合82分。",
        "risk": "三才金火土，天人相克，早年易感外部压力。",
        "act": "借助导师或平台缓冲早期压力。"
      },
      "mbti_note": "INTJ 的长期规划倾向与命宫天梁、官禄天机相互印证，属行为偏好参考。",
      "six_dimensions": {
        "career": {
          "signals": {
            "bazi": [
              70,
              "食伤生财，适合专业输出"
            ],
            "ziwei": [
              75,
              "天机官禄"
            ],
            "bone": [
              55,
              "重自力"
            ],
            "zodiac": [
              65,
              "狮子上升"
            ],
            "name": [
              78,
              "人格24"
            ],
            "mbti": [
              75,
              "INTJ 规划力"
            ]
          },
          "summary": "专业型成长路径，中年后渐入佳境。"
        },
        "wealth": {
          "signals": {
            "bazi": [
              60,
              "身弱担财吃力"
            ],
            "ziwei": [
              70,
              "太阴财帛"
            ],
            "bone": [
              50,
              "先劳后得"
            ],
            "zodiac": [
              60,
              "双鱼理财随性"
            ]
          },
          "summary": "稳健积累优于投机。"
        },
        "marriage": {
          "signals": {
            "bazi": [
              62,
              "财星为妻"
            ],
            "ziwei": [
              58,
              "巨门夫妻"
            ],
            "zodiac": [
              65,
              "月亮狮子重认可"
            ]
          },
          "summary": "沟通质量决定关系质量。"
        },
        "health": {
          "signals": {
            "bazi": [
              60,
              "缺火，注意循环"
            ],
            "ziwei": [
              72,
              "天府疾厄"
            ],
            "bone": [
              55,
              "劳碌"
            ]
          },
          "summary": "底子稳，需防劳损。"
        },
        "children": {
          "signals": {
            "bazi": [
              65,
              "食伤为子"
            ],
            "ziwei": [
              68,
              "廉贪子女宫"
            ]
          },
          "summary": "子女活泼，宜给空间。"
        },
        "spirit": {
          "signals": {
            "bazi": [
              66,
              "金水清明"
            ],
            "ziwei": [
              70,
              "太阳福德"
            ],
            "mbti": [
              72,
              "内省"
            ]
          },
          "summary": "理念驱动，需防内耗。"
        }
      },
      "advice_title": "行动建议",
      "advice": [
        "每季度公开输出一次成果，补足外显。",
        "重要分歧先写方案再讨论。",
        "以三年为周期复盘职业积累。"
      ],
      "sketch": {
        "core": "冷静的规划者，内心有温度。",
        "fate": "先劳后得，靠专业与口碑逐步积累。",
        "outer": "沉稳、有存在感，偶尔显得锋利。",
        "reconciliation": "与自己的锋芒和解——不是收起判断，而是让判断先经过证据。"
      }
    }
  ],
  "footer": {
    "confidence_pct": 80,
    "factors": "示例人物为虚构，坐标取城市中心。",
    "questions": "实际出生医院所在区县、是否有出生证明时间。"
  }
}
